{
  "schema_version": 1,
  "id": "d1",
  "thread_url": "https://www.linkedin.com/messaging/thread/2-EXAMPLE/",
  "approval_file": "C:\\Users\\<user>\\inbox-triage-20261016\\send-d1.txt",
  "sha256": "aaaaaaaaaaaaaaaaaaaaaaaaaaaaaaaaaaaaaaaaaaaaaaaaaaaaaaaaaaaaaaaa",
  "status": "RP-TEXT-MISMATCH",
  "started_at": "2026-10-16T12:00:00Z",
  "finished_at": "2026-10-16T12:05:00Z",
  "confirmed_at": "2026-10-16T12:01:00Z",
  "send_clicks": 0,
  "send_clicked_at": null,
  "typed_attempts": 3,
  "box_empty_at_end": true,
  "readback_equals_file": false,
  "proof": {
    "readback_path": null,
    "token_path": null,
    "screenshot_path": null
  },
  "errors": [
    {
      "at": "2026-10-16T12:00:00Z",
      "step": "x",
      "message": "y"
    }
  ],
  "tab_closed": true,
  "tab_group": {
    "anchor_reused": true,
    "tabs_opened": 1,
    "closed_anchor_last": true
  }
}
